{
  "id": "night.midnight.waning-crescent.supermoon",
  "apiVersion": "1.0.0",
  "rendererVersion": "global-library-2026-07",
  "label": "Midnight · Waning crescent · Supermoon",
  "mode": "night",
  "phase": "midnight",
  "moonPhase": "waning-crescent",
  "weather": "supermoon",
  "family": "rare-celestial",
  "category": "rare-celestial",
  "effect": "supermoon",
  "windProfile": "open-air",
  "attributes": {
    "key": "supermoon",
    "en": "Supermoon",
    "family": "rare-celestial",
    "category": "rare-celestial",
    "effect": "supermoon",
    "celestialEvent": "supermoon",
    "wind": 0
  },
  "links": {
    "self": "https://afnan-hossain.github.io/atmoscene/api/v1/scenes/by-id/night.midnight.waning-crescent.supermoon.json",
    "collection": "https://afnan-hossain.github.io/atmoscene/api/v1/collections/rare-celestial.json",
    "preview": "https://afnan-hossain.github.io/atmoscene/api/demo/?scene=night.midnight.waning-crescent.supermoon"
  },
  "runtime": {
    "mode": "night",
    "phase": "midnight",
    "moonPhase": "waning-crescent",
    "weather": "supermoon",
    "seed": 3336
  }
}
