{
  "id": "night.evening.waning-gibbous.drizzle-night",
  "apiVersion": "1.0.0",
  "rendererVersion": "global-library-2026-07",
  "label": "Evening · Waning gibbous · Night drizzle",
  "mode": "night",
  "phase": "evening",
  "moonPhase": "waning-gibbous",
  "weather": "drizzle-night",
  "family": "core",
  "category": "rain",
  "effect": "standard",
  "windProfile": "precipitation",
  "attributes": {
    "key": "drizzle-night",
    "bn": "রাতের গুঁড়ি বৃষ্টি",
    "en": "Night drizzle",
    "category": "rain",
    "condition": "drizzle",
    "rain": 1,
    "cloud": 1,
    "wind": 0
  },
  "links": {
    "self": "https://afnan-hossain.github.io/atmoscene/api/v1/scenes/by-id/night.evening.waning-gibbous.drizzle-night.json",
    "collection": "https://afnan-hossain.github.io/atmoscene/api/v1/collections/core.json",
    "preview": "https://afnan-hossain.github.io/atmoscene/api/demo/?scene=night.evening.waning-gibbous.drizzle-night"
  },
  "runtime": {
    "mode": "night",
    "phase": "evening",
    "moonPhase": "waning-gibbous",
    "weather": "drizzle-night",
    "seed": 197
  }
}
