{
  "id": "night.pre-dawn-night.waning-crescent.fog-night",
  "apiVersion": "1.0.0",
  "rendererVersion": "global-library-2026-07",
  "label": "Pre-dawn · Waning crescent · Night fog",
  "mode": "night",
  "phase": "pre-dawn-night",
  "moonPhase": "waning-crescent",
  "weather": "fog-night",
  "family": "core",
  "category": "visibility",
  "effect": "standard",
  "windProfile": "laminar",
  "attributes": {
    "key": "fog-night",
    "bn": "রাতের কুয়াশা",
    "en": "Night fog",
    "category": "visibility",
    "condition": "fog",
    "visibility": "fog",
    "wind": 0
  },
  "links": {
    "self": "https://afnan-hossain.github.io/atmoscene/api/v1/scenes/by-id/night.pre-dawn-night.waning-crescent.fog-night.json",
    "collection": "https://afnan-hossain.github.io/atmoscene/api/v1/collections/core.json",
    "preview": "https://afnan-hossain.github.io/atmoscene/api/demo/?scene=night.pre-dawn-night.waning-crescent.fog-night"
  },
  "runtime": {
    "mode": "night",
    "phase": "pre-dawn-night",
    "moonPhase": "waning-crescent",
    "weather": "fog-night",
    "seed": 942
  }
}
