{
  "id": "day.morning.none.windy",
  "apiVersion": "1.0.0",
  "rendererVersion": "global-library-2026-07",
  "label": "Morning · Windy",
  "mode": "day",
  "phase": "morning",
  "moonPhase": null,
  "weather": "windy",
  "family": "core",
  "category": "wind",
  "effect": "standard",
  "windProfile": "open-air",
  "attributes": {
    "key": "windy",
    "bn": "প্রবাহিত বাতাস",
    "en": "Windy",
    "category": "wind",
    "condition": "",
    "wind": 2
  },
  "links": {
    "self": "https://afnan-hossain.github.io/atmoscene/api/v1/scenes/by-id/day.morning.none.windy.json",
    "collection": "https://afnan-hossain.github.io/atmoscene/api/v1/collections/core.json",
    "preview": "https://afnan-hossain.github.io/atmoscene/api/demo/?scene=day.morning.none.windy"
  },
  "runtime": {
    "mode": "day",
    "phase": "morning",
    "moonPhase": null,
    "weather": "windy",
    "seed": 46
  }
}
