{
  "id": "night.evening.pink-moon.marine-fog-night",
  "apiVersion": "1.0.0",
  "rendererVersion": "global-library-2026-07",
  "label": "Evening · Pink moon · Night marine fog",
  "mode": "night",
  "phase": "evening",
  "moonPhase": "pink-moon",
  "weather": "marine-fog-night",
  "family": "tropical-marine",
  "category": "tropical-marine",
  "effect": "marine-fog",
  "windProfile": "open-air",
  "attributes": {
    "key": "marine-fog-night",
    "en": "Night marine fog",
    "family": "tropical-marine",
    "category": "tropical-marine",
    "effect": "marine-fog",
    "marine": 1,
    "visibility": "fog",
    "cloud": 1,
    "wind": 0
  },
  "links": {
    "self": "https://afnan-hossain.github.io/atmoscene/api/v1/scenes/by-id/night.evening.pink-moon.marine-fog-night.json",
    "collection": "https://afnan-hossain.github.io/atmoscene/api/v1/collections/tropical-marine.json",
    "preview": "https://afnan-hossain.github.io/atmoscene/api/demo/?scene=night.evening.pink-moon.marine-fog-night"
  },
  "runtime": {
    "mode": "night",
    "phase": "evening",
    "moonPhase": "pink-moon",
    "weather": "marine-fog-night",
    "seed": 2215
  }
}
