{
  "id": "night.midnight.blood-moon.clear-night",
  "apiVersion": "1.0.0",
  "rendererVersion": "global-library-2026-07",
  "label": "Midnight · Blood moon · Clear night",
  "mode": "night",
  "phase": "midnight",
  "moonPhase": "blood-moon",
  "weather": "clear-night",
  "family": "core",
  "category": "clear",
  "effect": "standard",
  "windProfile": "open-air",
  "attributes": {
    "key": "clear-night",
    "bn": "পরিষ্কার রাত",
    "en": "Clear night",
    "category": "clear",
    "condition": "",
    "wind": 0
  },
  "links": {
    "self": "https://afnan-hossain.github.io/atmoscene/api/v1/scenes/by-id/night.midnight.blood-moon.clear-night.json",
    "collection": "https://afnan-hossain.github.io/atmoscene/api/v1/collections/core.json",
    "preview": "https://afnan-hossain.github.io/atmoscene/api/demo/?scene=night.midnight.blood-moon.clear-night"
  },
  "runtime": {
    "mode": "night",
    "phase": "midnight",
    "moonPhase": "blood-moon",
    "weather": "clear-night",
    "seed": 532
  }
}
