{
  "id": "night.late-night.waxing-gibbous.smoke-night",
  "apiVersion": "1.0.0",
  "rendererVersion": "global-library-2026-07",
  "label": "Late night · Waxing gibbous · Night smoke",
  "mode": "night",
  "phase": "late-night",
  "moonPhase": "waxing-gibbous",
  "weather": "smoke-night",
  "family": "aerosols",
  "category": "aerosols",
  "effect": "smoke",
  "windProfile": "aerosol-flow",
  "attributes": {
    "key": "smoke-night",
    "en": "Night smoke",
    "family": "aerosols",
    "category": "aerosols",
    "effect": "smoke",
    "aerosol": 1,
    "visibility": "smoke",
    "wind": 1
  },
  "links": {
    "self": "https://afnan-hossain.github.io/atmoscene/api/v1/scenes/by-id/night.late-night.waxing-gibbous.smoke-night.json",
    "collection": "https://afnan-hossain.github.io/atmoscene/api/v1/collections/aerosols.json",
    "preview": "https://afnan-hossain.github.io/atmoscene/api/demo/?scene=night.late-night.waxing-gibbous.smoke-night"
  },
  "runtime": {
    "mode": "night",
    "phase": "late-night",
    "moonPhase": "waxing-gibbous",
    "weather": "smoke-night",
    "seed": 2939
  }
}
