{
  "id": "night.midnight.waxing-crescent.breeze-night",
  "apiVersion": "1.0.0",
  "rendererVersion": "global-library-2026-07",
  "label": "Midnight · Waxing crescent · Night breeze",
  "mode": "night",
  "phase": "midnight",
  "moonPhase": "waxing-crescent",
  "weather": "breeze-night",
  "family": "core",
  "category": "wind",
  "effect": "standard",
  "windProfile": "breeze",
  "attributes": {
    "key": "breeze-night",
    "bn": "রাতের মৃদু বাতাস",
    "en": "Night breeze",
    "category": "wind",
    "condition": "",
    "wind": 1
  },
  "links": {
    "self": "https://afnan-hossain.github.io/atmoscene/api/v1/scenes/by-id/night.midnight.waxing-crescent.breeze-night.json",
    "collection": "https://afnan-hossain.github.io/atmoscene/api/v1/collections/core.json",
    "preview": "https://afnan-hossain.github.io/atmoscene/api/demo/?scene=night.midnight.waxing-crescent.breeze-night"
  },
  "runtime": {
    "mode": "night",
    "phase": "midnight",
    "moonPhase": "waxing-crescent",
    "weather": "breeze-night",
    "seed": 437
  }
}
